{
  "schemaVersion": 1,
  "fixtureId": "download-station.bt-search-get-categories.synthetic-options",
  "module": "download-station",
  "operation": "getBtSearchCategories",
  "api": {
    "name": "SYNO.DownloadStation.BTSearch",
    "method": "getCategory",
    "preferredVersion": 1,
    "resolvedVersion": 1,
    "resolvedPath": "DownloadStation/btsearch.cgi"
  },
  "transport": {
    "httpMethod": "POST",
    "requestFormat": "form"
  },
  "parameters": [],
  "authentication": {
    "required": true,
    "synoTokenRequired": false,
    "sessionLocations": ["cookie", "form"],
    "synoTokenLocations": ["header", "form"]
  },
  "policy": {
    "retryPolicy": "readOnlyAutomatic",
    "risk": "read",
    "readbackPolicy": "none"
  },
  "source": {
    "kind": "synthetic",
    "evidence": "publicDocumentation"
  }
}
