{
  "schemaVersion": 1,
  "fixtureId": "download-station.bt-search-list.synthetic-filtered",
  "module": "download-station",
  "operation": "listFilteredBtSearchResults",
  "api": {
    "name": "SYNO.DownloadStation.BTSearch",
    "method": "list",
    "preferredVersion": 1,
    "resolvedVersion": 1,
    "resolvedPath": "DownloadStation/btsearch.cgi"
  },
  "transport": {
    "httpMethod": "POST",
    "requestFormat": "form"
  },
  "parameters": [
    {"name": "taskid", "valueType": "string", "encodedValue": "<synthetic-search-task>"},
    {"name": "offset", "valueType": "integer", "encodedValue": "0"},
    {"name": "limit", "valueType": "integer", "encodedValue": "200"},
    {"name": "sort_by", "valueType": "string", "encodedValue": "size"},
    {"name": "sort_direction", "valueType": "string", "encodedValue": "asc"},
    {"name": "filter_category", "valueType": "string", "encodedValue": "<synthetic-category>"},
    {"name": "filter_title", "valueType": "string", "encodedValue": "<synthetic-title-filter>"}
  ],
  "authentication": {
    "required": true,
    "synoTokenRequired": false,
    "sessionLocations": ["cookie", "form"],
    "synoTokenLocations": ["header", "form"]
  },
  "policy": {
    "retryPolicy": "readOnlyAutomatic",
    "risk": "read",
    "readbackPolicy": "none"
  },
  "source": {
    "kind": "synthetic",
    "evidence": "publicDocumentation"
  }
}
