{
  "schemaVersion": 1,
  "fixtureId": "file-station.compress.synthetic-selection",
  "module": "file-station",
  "operation": "compress",
  "api": {
    "name": "SYNO.FileStation.Compress",
    "method": "start",
    "preferredVersion": 3,
    "resolvedVersion": 3,
    "resolvedPath": "entry.cgi"
  },
  "transport": {
    "httpMethod": "POST",
    "requestFormat": "form"
  },
  "parameters": [
    {
      "name": "dest_file_path",
      "valueType": "string",
      "encodedValue": "<synthetic-archive-path>"
    },
    {
      "name": "format",
      "valueType": "string",
      "encodedValue": "7z"
    },
    {
      "name": "level",
      "valueType": "string",
      "encodedValue": "best"
    },
    {
      "name": "mode",
      "valueType": "string",
      "encodedValue": "add"
    },
    {
      "name": "password",
      "valueType": "string",
      "redacted": true
    },
    {
      "name": "path",
      "valueType": "stringArray",
      "encodedValue": "[\"<synthetic-source-directory>\",\"<synthetic-source-file>\"]"
    }
  ],
  "authentication": {
    "required": true,
    "synoTokenRequired": false,
    "sessionLocations": ["cookie", "form"],
    "synoTokenLocations": ["header", "form"]
  },
  "policy": {
    "retryPolicy": "queryStateBeforeDecision",
    "risk": "standardWrite",
    "readbackPolicy": "required"
  },
  "source": {
    "kind": "synthetic",
    "evidence": "publicDocumentation"
  }
}
