{
  "schemaVersion": 1,
  "fixtureId": "download-station.save-schedule.synthetic-settings",
  "module": "download-station",
  "operation": "saveSchedule",
  "api": {
    "name": "SYNO.DownloadStation.Schedule",
    "method": "setconfig",
    "preferredVersion": 1,
    "resolvedVersion": 1,
    "resolvedPath": "DownloadStation/schedule.cgi"
  },
  "transport": {
    "httpMethod": "POST",
    "requestFormat": "form"
  },
  "parameters": [
    { "name": "emule_enabled", "valueType": "boolean", "encodedValue": "false" },
    { "name": "enabled", "valueType": "boolean", "encodedValue": "true" }
  ],
  "authentication": {
    "required": true,
    "synoTokenRequired": false,
    "sessionLocations": ["cookie", "form"],
    "synoTokenLocations": ["header", "form"]
  },
  "policy": {
    "retryPolicy": "queryStateBeforeDecision",
    "risk": "standardWrite",
    "readbackPolicy": "required"
  },
  "source": {
    "kind": "synthetic",
    "evidence": "publicDocumentation"
  }
}
