{
  "schemaVersion": 1,
  "fixtureId": "file-station.move.synthetic-task",
  "module": "file-station",
  "operation": "move",
  "api": {
    "name": "SYNO.FileStation.CopyMove",
    "method": "start",
    "preferredVersion": 3,
    "resolvedVersion": 3,
    "resolvedPath": "entry.cgi"
  },
  "transport": {
    "httpMethod": "POST",
    "requestFormat": "form"
  },
  "parameters": [
    {
      "name": "accurate_progress",
      "valueType": "boolean",
      "encodedValue": "true"
    },
    {
      "name": "dest_folder_path",
      "valueType": "string",
      "encodedValue": "<synthetic-destination>"
    },
    {
      "name": "overwrite",
      "valueType": "boolean",
      "encodedValue": "true"
    },
    {
      "name": "path",
      "valueType": "stringArray",
      "encodedValue": "[\"<synthetic-path>\"]"
    },
    {
      "name": "remove_src",
      "valueType": "boolean",
      "encodedValue": "true"
    }
  ],
  "authentication": {
    "required": true,
    "synoTokenRequired": false,
    "sessionLocations": [
      "cookie",
      "form"
    ],
    "synoTokenLocations": [
      "header",
      "form"
    ]
  },
  "policy": {
    "retryPolicy": "queryStateBeforeDecision",
    "risk": "destructive",
    "readbackPolicy": "taskPoll"
  },
  "source": {
    "kind": "synthetic",
    "evidence": "sourceReviewed"
  }
}
