{
  "schemaVersion": 1,
  "fixtureId": "chat.join-private-group.synthetic-group",
  "module": "chat",
  "operation": "joinPrivateGroup",
  "api": {
    "name": "SYNO.Chat.Channel.Named",
    "method": "join",
    "preferredVersion": 1,
    "resolvedVersion": 1,
    "resolvedPath": "entry.cgi"
  },
  "transport": { "httpMethod": "POST", "requestFormat": "form" },
  "parameters": [
    { "name": "channel_id", "valueType": "string", "encodedValue": "synthetic-channel" }
  ],
  "authentication": {
    "required": true,
    "synoTokenRequired": false,
    "sessionLocations": ["cookie", "form"],
    "synoTokenLocations": ["header", "form"]
  },
  "policy": {
    "retryPolicy": "queryStateBeforeDecision",
    "risk": "standardWrite",
    "readbackPolicy": "required"
  },
  "source": { "kind": "synthetic", "evidence": "sourceReviewed" }
}
