{
  "schemaVersion": 1,
  "fixtureId": "chat.create-poll.synthetic-poll",
  "module": "chat",
  "operation": "createPoll",
  "api": { "name": "SYNO.Chat.Post.Vote", "method": "create", "preferredVersion": 1, "resolvedVersion": 1, "resolvedPath": "entry.cgi" },
  "transport": { "httpMethod": "POST", "requestFormat": "form" },
  "parameters": [
    { "name": "channel_id", "valueType": "string", "encodedValue": "synthetic-channel" },
    { "name": "message", "valueType": "string", "encodedValue": "Synthetic question?" },
    { "name": "choices", "valueType": "stringArray", "encodedValue": "[\"First choice\",\"Second choice\"]" },
    { "name": "options", "valueType": "string", "encodedValue": "{\"add_option\":false,\"anonymous\":false,\"multiple\":true}" }
  ],
  "authentication": { "required": true, "synoTokenRequired": false, "sessionLocations": ["cookie", "form"], "synoTokenLocations": ["header", "form"] },
  "policy": { "retryPolicy": "queryStateBeforeDecision", "risk": "standardWrite", "readbackPolicy": "required" },
  "source": { "kind": "synthetic", "evidence": "sourceReviewed" }
}
